0,Oh - Just got all my MacHeist 3.0 apps - sweet. Didn't get the Espresso serial no though although they said they sent it - oh well 
0,@shaundiviney wanna come with us to manly tomoz? or r ya busy  x
0,I should have told Jordan to tweet his way onto the plane 
0,"@JAMILInRealLife I **hate** waking up that early... but six days a week, I have no choice "
0,Just meet Ms. Massachusetts at the Aids Walk :-D! Too bad I don't know how to post mobile pics 
0,@Don_J thankies... i'm such a big baby when it comes to thunder n lightening 
0,Just waking up w/ the babygirl. She's fed and watching handy manny now. Getting ready to go to anniversary party--not ours. 
0,Is up early and nt feelin well 
0,"tryin' to figure out  wt i should do next,i'm always lost, down or wt u say depressed,wt is happenin to me,i duno..plz make me a way God "
0,Sunday in office 
0,wants to play Sims 3 
0,I MISS YOU!  @roch_3ll3
0,I'm craving for Starbucks. It's been a long time since I had a frap 
0,"@VanessaaHudgens sometimes, the paparazzi exaggerate "
0,i hate sunday bus service  trying to get to town for more stationery when really all i want to do is curl up and sleep *whimpers*
0,@unahealy not very summery today tho is it?  What you gonna wear?
0,boredboredbored. i wanted to watch gossip girl but the fams taken the tv.  i never get to watch GG. sucks.
0,So the good news is that days &amp; days of grueling torture paid off~100 on Beowulf test...now reading Sir Gawain &amp; the Green Knight...ugh 
0,sometimes I hate having two days off in a row.  I come back to work having to do damage control. 
0,Ew. There's apple in my braces. And I can't find Harry Potter and the Half Blood Prince. How depressing 
0,at home.....unpacked case......p'ssing down and cold outside.... back in work tomoz.... YAY - (not !)   
0,http://twitpic.com/6jsf8 - The days when it was sunny 
0,Sundays is the worst day to wake up early 
0,"urgh, borin' sundayss  asif my sister decided that we're doin' what we were supposed to do today tomorrow + i have no credit to text Lucc"
0,has prefect camp tomorrow! not as excited as I thought I would be probably because of my physic practical tomorrow. hmph 
0,"naw i wont do that, thats mean "
0,wishing it wasnt cold and rainy 
0,Sunday morning. And we're gonna be cleaning. 
0,@chris_vaughan I think she did 
0,I feel sick. No reason. 
0,@rachelk94 I totally agree. My day has gone into learning theorems ans maths formulas....... 
0,"another beautiful day wasted stuck at home, damnit! "
0,"GOOD MORNING ! I mean, good afternoon, it's 12pm :x I have just waken up and had a huge cup of coffee. great, but I still hate Sundays "
0,@doncarloiv Heart pinch just didn't work out and it hurts 
0,"Et tu damned rain, couldn't watch #Federer win his career grand slam coz of power outage "
0,@iitsMolly  I'm sorry!
0,@BeckyC3 lol. i need a drink but if i move my parents will make me tidy my room 
0,"@SunnyBuns  she wasnt sure about the meals on wheels, because of her age, "
0,"is awake! legs feel like jello from last night random jog, work soon  in the mean time listening to hit the lights ;)"
0,@tommcfly do you hate me or somthing? i just want you to look&amp;comment!  http://www.twitpic.com/5f9e1 &amp; http://www.twitpic.com/5hfjr
0,@LostInInaka thanks. She is TSUMETAI!! And horrible to me. Nice enough to everyone else tho 
0,I really dont want to study. 
0,@tubagurlluvsyou  the dye didnt take  it's barely any different
0,@rmking4  I can't get the fricking Joey video from Thurs to Load... I want you to see it... waaaaaa Gonna try something else. (and thx)
0,Doesnt wanna leave NY 
0,i feel like silly puddy!!!! 
0,the red/purple colour seems too have disapeared from my hair.it just looks brown again 
0,@kirstiealley lucky to have work!We lost our business!Uuuuggghhh!!!! 
0,i miss my babe soooooooo much 
0,i just hit my head on the lowest ceiling ever. owww 
0,"@outofcontrol09 hey did u take ne gd vids of the girls' last concert yesterday? cos im dyin 2 c some, and no-ones put them on youtube yet "
0,@dlpasco dude that sucks 
0,morning twits! i been bad - not updating    well here i am!
0,@jordanknight ummm link not working 
0,"ugh, still with this headache...  hopefully it will go away soon...apparently it's affecting my ability to spell as well. lol"
0,I know everyone likes reading about crafty screw ups. here's mine today: http://tr.im/nGsA had to vent 
0,@Zackarydoo   if only the blackberry  server would actually let me GET anywhere   UGH
0,I loved living smiling. but not always with you. 
0,is it weird that i still have the sticker thing on the screen of my phone? lol i don't want it to get dirty/scratched. 
0,@rebeccagoings so sorry   Safe travels
0,Reality is kicking in. Will be home this time tomorrow 
0,@Bushwalla it seems it's time for some hula hooping on the beach ! Lil rain in Paris too  but no beach &amp; no hula hoop
0,"@mitchelmusso i would love to, only one problem i live in Canada  and another problem is i dont have ur CD YET!, im goin soon 2 get it !"
0,@JazKrimes ADW has nothing to do with hating men.. 
0,Landed. Cold now 
0,well time for work 
0,It's official. I'm an orphan. 
0,When is #comcast going to update this ancient digital cable menu in Carroll County and their boxes? Slow as hell too. 
0,Homework while Morgan naos...  I would much rather nap with her!!
0,"and no, i'm not crazy, i'm just taking advertising "
0,@RickyDeHaas I knoow  much too long! if your ever in Vancouver let me know 
0,@AmandaWenek i am back in halifax now  i miss toronto
0,"@R_Perkins  But relatively harmless, right?"
0,while getting a fork out of the cupboard a knife stabbed me- it hurt + i cryed..... 
0,Not very satisfied 
0,"I'm losing followers, and it makes me sad "
0,@beccatoria BOO.   But welcome back! I just finished watching the deleted scenes. Actually agree with 95% of the cuts this time.
0,My foot 
0,@PlayRadioPlay What do you mean &quot;you don't know me&quot;? I thought we had a thing going! 
0,@joannahayes1223 Ya... I knowwww! 
0,@kalilekkas hey babes... i havent been on the computer in a week so all my updates been mobile..  im tryna be on more tho.
0,@FinalCylon For Asheville? 
0,went to the yankee game with kyle yesterday.. what a great day. i miss him bunches 
0,@jiashing you cant come?! 
0,Big Brother feels like a waste of time without the live feed  I won't be voting since I don't even *know* the people in the house :/ #bb10
0,@WaKeUp2MuSiC i need 2 but my string 
0,@sophieholly aww  what's up lovely?
0,needs The Apprentice! NOW! 
0,"@PammaApple Sorry I'm not replying as fast, My tweetdeck is down. "
0,I miss my bunny.   She died on Tuesday.
0,"noooo..., drop by 1  33. sulumits-retsambew.biz"
0,"Gymmm, then backk to the damn books "
0,high school will never be the same now. I already miss him 
0,@LishaP16 rainy  I'm at the Sun's game and it has been postponed because of the rain.
0,@The_Librain well I do control budget for buying new books but have to do the selecting via supplier website - just doesn't do it for me 
0,I am really hungry  I guess we are going to eat and after I will get dressed.  School starts tomorrow.  I am kind of half-way dreading it.
0,Up early after a sleepless night 
0,My days are numbered now!  6 Days to go! 
0,Weekend gone to quick 
0,i broke a nail 
0,I am exhausted. Fell asleep for an hour... almost forgot to make kid supper. 
0,wishes she could help all the cats 
0,Left my ds at my cousins house.  
0,@rjbishere yes it seems thats all i do 
0,@tamrinm yes! and poor peter   but I love their knockoff &quot;rainbow room&quot; lol
0,"computer dead, laptop useless, studio not up and running have to cancel this weeks Haunted Downunder "
0,i think i have to go to bed! I'm so tired! And i lost 9 followers!  @NicLovesHabs have fun and enjoy! I call you tomorrow!
0,frankie is gone  ill miss you buddy but im there in 3 days 
0,"I am shattered, had two very long days "
0,"Apprentice?????? How Sir Alan, just how??????? "
0,I just uploaded pictures of my bedroom redo on Rate My Space and YIKES... people are very mean!!!  
0,"@NBloggz Dude, sucks so hard that it's scratched.  Do you have a case? Which?"
0,So drained from stocktake  - Don't know how I lasted with only 4 hours sleep...never eaten a fish supper so quickly before tonight.
0,Leaving Austin is always so sad 
0,"it really, reeeeeally hurts "
0, training is over #njdfatrain
0,No I didn't want yasmina or however you say it to win poor Kate  http://bit.ly/7bMd9p
0,Laptop is still dead.  Exam week... must study.  Missing important emails being computerless too  Wanna watch primeval finale
0,Feeling &quot;fatigued&quot; today. I'm already in bed.     ~One Blessed Sista!~
0,Sooooooooooooooooooo cold 
0,"sat here reading aloud my history notes...feel v.silly! exam 2moz and no more study leave  so tired,gona be a good sleep"
0,nothing for BNP in eastern regions  @mhoobag1
0,@KiaFab2 sounds like a plan. It will be just me tho. M is not feeling well and at his moms. 
0,"@sweetboomerang hell yeah, good times my friend. Majorly hanging today tho "
0,@SteveSyfuhs No.... not going to.  Got one of them &quot;ChopOMatic&quot; things on TV and tried to make Salsa.  Succeeded.  And I forgot beer 
0,@tinoforever I'm hoping 8 hours straight revision will be enough for this. 
0,Waking up. No work. Makes today feel like Saturday which makes going to work tomorrow hard 
0,@dougiemcfly rescue them  x
0,can't get any new maps for my gps! anyone know how to hack gps devices?? need help 
0,fack this poor lifeee  making inserts.
0,So much for that nap 
0,"@missheathyrm It's taken, girl.  Go read my comment."
0,My car after my accident on Thursday... Scary as hell a truck pulled out right infront of me  http://tinyurl.com/kuglgl
0,@eshenayo  &quot;The URL contained a malformed video ID.&quot;
0,@sdotspider you know I live in an apartment! But i miss home! Immensly  
0,@omgwtfannie guess we both have wardrobe mishaps today 
0,@Heaatherrr mhmm i'm cold 
0,omg @hockeygal4ever and @kuraihime I am achingly jealous of  your fun places w beverages!  I'm in a haunted office) haa.
0,I'm off! Meeting time! YAY! 
0,@Samtherockstar   http://bit.ly/KaOdm    the  eggplant shirt :0
0,@GeorgeDvorsky makes me lose hope for the future quite frankly. 
0,i need to get a new DVD player. The one I have keeps on freezing up 
0,"Ugh, sore throat. Hope dad didn't pass his fever over to me. "
0,"The cats are freaking out, moving is hard on kitties  "
0,Cat died today.  
0,@Peter_Henley Bloody hell 
0,@sarandipity I watched all 13 over 2 days. Now I've finished it I'm having major withdrawls. 
0,In need of a major back and leg massage! I can't move! 
0,Sad days...Im deathly ill and my parents are off to Florida the day after tomorrow... 
0,@4evaurgirl nm scared shitless i wanna pee in my pants 
0,@Annanomaly Yes ma'am. I'll go to bed then I guess. 
0,Ate too much ice cream. 
0,The place where daddy hit me is still so red 
0,Aww recital ended a couple hrs ago....when seniors made their speeches i almost cried again...what am i gonna say next year?  ~Tina~
0,@Lizzie_Poo ohhhh wow that sucks 
0,on holidays and bored already  plastic last nigtt was awful
0,I don't want this SWAC episode to end. 
0,iMiss my lil bro!  i should go sweat with him &amp; his dad. Every time they go!
0,"@selenagomez jsyk, my lil sis called ur saynow to leave a msg but she was rly nervous&amp;i kept buggin her bout it&amp;now she's in a bad mood "
0,"almost done with the new Geek Dads episode... been a busy week, have had to do it a little at a time over two days "
0,misses someone terribly   
0,Homework!!!!       
0,You know it's bad when you litterally dread going to work. Can't wait till I never have to do this again. Ugggg... 
0,Hello!! I'm watching role models... Not that funny... :| 
0,back to work tomorrow and the annoying girl who works next to me  if you notice any weird tweets tomorrow they're from her haha
0,@stefanusirwanto quite possible because the ext hd I used to copy files is unreadable and prob. need to format 
0,"@yelyahwilliams,Answer me please "
0,@pollinatewildly Awww...sorry you had a crappy day at work.    
0,miss my friend ... 
0,"@jcurries If I didn't win the lottery last night, I'll be sending my cancellation in tomorrow. "
0,"Ohmyyygoodness, the school year is almost over "
0,prom journalism article. bed. school  7 days left till finals!
0,"@vonilicious the fact that i don't know what i bought him? yea, i wanted to replace the ipod that got stolen during xmas, but...w/e "
0,Waiting for my peeps... there are cops all around the movie theater. Better keep my penis in my pants tonight. 
0,Yey finished studying but sadly today is only day one of studying... 
0,Needs to stop getting up for the let down 
0,i can't believe jake's graduating tomorrow.  what am i gonna do w/ both of my brothers gone?! 
0,i think im sunburnt  im freeeeeezzing cold!
0,alone and un cared for 
0,@HannahRobertson Owwwww... Come back soon Hannah!  Melbourne will miss you!
0,@stevehammer        I'll think happy thoughts.
0,@Helohim  te ries de mi no emes?
0,sigh...and back to class in the morning 
0,@drobo oh man! had my video all set to send to you but I'm not in the States so I can't win. Times like this I dislike being Canadian. 
0, not allowed to get a webcam...did i already say that? oh well
0,hmmmmmmmmmmmmm what to do? def. not sleepy 
0,@flalalala !  coz i dont know if people mean what they say or they say things just for the sake of it.
0,G : Hay naku si Jude...reminded me of something that really pissed me off yesterday  Dont get me started again.
0,Uriah Favre lost  Broken right hand and still finished the fucken fight!! He's a freakin awesome fighter!
0,"Totally frustrated!!!!  Well, at least this loss wasn't as bad as the last--Hedo did his part. Anyone know what's up with D. Howard?? "
0,Total of 95652 nasty creepy men @ the liquor store...&amp;Me...in itty bitty shorts&amp;tank 
0,Sadly...yes she is... 
0,Cool day I really hope tommrow happens 
0,@theBrandiCyrus aww are you going to visit her? you should 
0,I have 3 mosquito bites on my butt from sitting in the grass. 
0,"@tobiasbuckell I loved the book immensely and had high hopes and there were a few changes that made no sense to me, just weren't needed "
0,can't find her sudafed 
0,Q: What's worse than losing to the Lakers?  A: Losing to the Lakers in the NBA Finals in an overtime thriller 
0,@tiffycope i thought we were BFLs... 
0,Have a fever 
0,@2Cheetah imma call u in da AM I'm beat 
0,@absurdities  Thanks for the warning. I will avoid that one even though it looks cute.
0,So angry  sat down to watch my dvr recording of Kendra just to find out for some reason it didn't record or I forgot to set it.....UGH!!!!
0,"Well that was the worst nights sleep ive had in a long old time. Worry about Nieces, mortgages &amp; rats kept me awake for most of it "
0,@chrisj1k LOL I'm not ughhhh I understand how u feel 
0,"Days ended before it seemed to have begun! I didn't even get much time to tweet today 2 everyone, sowwy  Goodnight and sweet dreams 2 all"
0,Ew. I've still got an hour left. Blegh. 
0,i dont want to go to bed bc that'll mark the official end of my weekend 
0,i want my TWLOHA hoodie to come 
0,you know what day its gonna be when you start it by hitting your visapincode wrong 3 times 
0,Aaaah! I hate school reports 
0,"i hate mangroves, and i feel like a LOG. did so much walking today "
0,is up early on his week off and it's raining 
0,I hope the minimise to tray feature is restored on #TweetDeck soon 
0,has to go now.   gonna watch step up. it is amazing!!!
0,@CH3L3 i know! i haven't performed for so long  maybe it's time for a karaoke session hehehe
0,"RIP- Cpl. Charles Dustin “Dusty�? Parrish passed on June 4 2009 in Iraq and was supposed to come back home July 15th to Columbus,GA "
0,Digital transitioning gave me free porno. 
0,*yawwwwwwwwwns*....long day ahead. Boo.  See you guys in 12 hours time.
0,this episode of JONAS makes me sad  i hate penny BITCH  :@:@
0,Only 4 days left .. 
0,waching TV and wishing Rick was home from the hospital. he has been in the hospital almosy 6 months now. 
0,reely dont feel like goin 2 skool 
0,dissapointed my photoshoot didnt turn out as good as I'd first hoped 
0,@ChetnaBinu yaar my stupid mtnl net hasn't been working for the last 2 days.. Lets hope im able to cm online tonite 
0,"Almost.... Finished...... Decorating,.... My....... Rooooomm.... Shit I'm tired. Got work in 4 hours!!! "
0,I'ma miss having you &amp;&amp; YoungKing'z pic in my page   ...I'ma sleep thiz one off...car iz coming 2takeme 2 the airport @ 6:45a...GOODNITE
0,"@nikhilnarayanan Didn't do it first!  Exported blog though.  Some memory issues, yet working fine now. "
0,tRyiN tO sLeEp But sOmetHiNgS MiSSiNg 
0,@Jen_Bunni haha ur such a fatty lol.and u didnt save me any! 
0,@joeymcintyre is what I'm reading correct?? NKOTB have cancelled to OZ tour?? please tell me it's not true 
0,i wish i had a computer available rn  i need to listen to atl's new song D:
0,@petehinton I don't finish until the end of August  (via @joedetic)
0,"I wonder when facebook phishing sites will come up, I don't trust a login pop up to originate from facebook, anyone can mimmick that "
0,@JustinPollard http://bit.ly/SQ6su  - it doesn't mention anything about breaking one in though 
0,Blew up my van  http://yfrog.com/08dfdlj
0,"@TheLadyJane Unfortunately, they're at opposite ends of London  These boys need organising better LOL"
0,Amazing night! I can't explain how much I love my friends. And @billyraycyrus was amazing. Eventhough we never made it to Bobs Big Boy 
0,"@samanthablews oh my god, I might die. Mum said no more shows after tai / anberlin till I finish school.  I can't miss william doing an"
0,body shutting down 
0,Night Kittnny! it's like 4:06 am here but i could sleep 
0,@joeymcintyre is it true the Australian tour has been cancelled? Was looking forward to it 
0,preparing for recitals!!! and exams!! 
0,Neurovegetative dystonia symptomes again. 
0,i feel a little bit sick - more likely my two choccy biscuits than the 2 bbqs at weekend 
0,"#maduk - Carl Taylor (3): grand ideas like #Mlove &amp; #esoou are against agencies lack of trust in mobile media, still  (via @mlovesociety)"
0,the poor kinsella family 
0,@StephenRinaldo I know.  bye bye Geni mou. #masterchef
0,@tommcfly Please Come To Sweden!! we need you  xx
0,@Neesh_ heyy how are you? did you know the @realjessicaalba profile was fake and it got shut down?  I can't believe it wasnt real!
0,"now at work, starting 3.5 hours early, leaving 3.5 hours early. @paleozoic wont be back for 3 whole weeks "
0,Throat still really hurts. I think im comming down with something 
0,@bloodyc where are my red roses??? u didn't give me any  sniff sniff
0,Why are they smoking?  I hate it
0,"Tried 3 routers before got useful log, end result is bad though, I got a line problem "
0,Who's a good debater ? Coz i need help 
0,@subeta ... how long will it take before move.subeta.net stops working? I still cannot get in using http://www.subeta.net 
0,"Ordered pizza from local Italian, was genuinely inedible "
0,has imsomnia. Again. I hate that even though I'm muy (: when I lay down sleep just won't come.   http://plurk.com/p/1127gb
0,i cant get comfyyy  im sitting on my spongebob hoodie ;D
0,Loving the wine we bought in Milan... wish I had more 
0,I need some time to chill. Someone to hang around wif. Everyone's busy  Anyone's free? Aiyay yay! - http://tweet.sg
0,"Drained and annoyed, exhausted and irritated. Must think of my happy place. "
0,had a stressful Monday at the office... 
0,"@adamlawlz oath lol, but after u figured me out theres no more excitement  lol"
0,oh how i miss marian 
0,I need assistance finding the CURRENT Kidd Kraddick show on iheartradio 
0,chicken sarnie for lunch- tired today  hopefully new (crochet) post later!
0,@marcoruiz Hi! Yes I do feel a little better. I have been taking medicine 
0,"i hate basketball, if i have to play it at school  i always hurt myself"
0,Droping of my sister in davis elementary been up since 6 
0,drowning in tomato soup....  hayfevers killing me!
0,"This a.m., I wish it were acceptable for adults to throw themselves to the ground &amp; kick &amp; scream &amp; have a 2 year old-style tantrum. "
0,Enjoying a cheese and spring onion sandwich.. I got up a bit late again. 
0,on the #5 train goin' to werk UGH  !!!! Mondai Blues!!!
0,"Sitting in class, wishing I could go back to sleep. "
0,@Mich80sbaby same thing work 
0,School was alright. I didn't get to eat my nasi lemak though  perhaps tomorrow!
0,Good Morning Twitterville! Another rain fulled day in NYC  but the show must go on!
0,"Oh crap Monday already, and no NKOTB concerts in site for me "
0,The last #tweetdeck update broke the app.  Pity. Less features is never good...
0,My ex-boyfriend fucks 17 year-old boys that look like pre-op trannies 
0,@BeckyEC oh no! dislike New York!  I'd best not read it then...
0,I do have work  i really could be doing with another few weeks off looking forward to tonight even more now ;-)
0,oh no here comes the grey skys 
0,@paulanicole13 i'm sorry beautiful! I wish you werent sick  ur projects were due today? Its too bad u cant have someone bring them in ...
0,"@pikestaff I feel the same way, but I got the 4 Horseman XBow and it's better than the Nessingwary 4k. "
0,mm not enough tickets wer sold for ozzy tour. this cud effect any planthey may ov had to cum to uk europe.  !!
0,I see so many people with children. Sometimes I think it is never going to happen for me. 
0,Cara: well done me...gone and set yourself up for tears...she is going to say no. why do i do it to myself?! 
0,has had enough and wants to run away and hide forever... 
0,"After a good mornings work on presentation, finding it hard to get back into it post lunch "
0,"sitting next to 3 guys in wheelchairs, and their all friends. "
0,WindowsIT Pro took away my digital magazine archive page! looks like its been replaced with a new digital delivery system  damn it
0,ok Nambu bugs are seriously pissing me off. might have to look into other twitter aps if not fixed soon. 
0,"@theresapgorda Spent lots of time in Matlacha/Pine Island when 1st in SWFL. Little dissapointed Sat, everything closed @ 11. Slow season "
0,@ShizukaWright i slept thru most of it.  how was yours?
0,@iruffkookydough went partee last fri with my friends... all are complaining i put on weight... 
0,@MarieC09 Thats a shame.. I thought the last series was the best one we`d had so far 
0,"wow, so tired.. i don't think i'm adjusting to the warm weather very well at all "
0,Going to bed. Need to be up by 5.30 
0,Is BOOORED on the train back to london! 
0,"@skinnyribs haha it's okay!  I don't know, i'm going to broke for a while sadly, he'd look so good next to my green one as well ha "
0,went to sleep with a migraine.  Woke up with a migraine. It's gonna be a good day tater. 
0,really want to go home 
0,"@tag i've been told in no uncertain terms 'In the meantime, please don’t; edit the text of the main themes.' "
0,I think I have a little headache  maybe becuz I have to study History..? :o)
0,sick as a dog.  ugh
0,"i'm ill, leave me alone. "
0,@chris_rea Car Crash? :O You okay? I know the feeling with the funds.. work cut me back to 2 days a week 
0,http://twitpic.com/7gteh - Not wanting to leave Vegas~ 
0,Ahhh we are leaving at 12:30 and im not even close to being finished 
0,is off to work soon 
0,"@Sheald worlds better thanks!! What a horrid, horrid day! "
0,I can never look at the lincoln memorial the same way again. 
0,my macbook is starting to crack at the bottom.. is this normal !?!?! 
0,"Good morning Rise, wish you could join me in a cup of coffee. Just sold one of my sewing machines along with the cabinet.  "
0,@sneakyfox You just lost seven points for that comment! I may miss the game on Wed. too 
0,@electricsoup i guess you are not liking the new building so far 
0,"@muirsusan I pray kimberly is better today.  God hugs you both.  Camera wasn't lost, it was stolen.  "
0,has a really bad headache  xxx
0,Off to a bad start. Seems I way overwatered my plant Friday. Now I've got a half dead plant and slimy smell stuck in my nose. Yuckee! 
0,sooo im without a car at the moment  buT i do get to spend the day w/ my sis about to make her go places with me cuz im already BORED!
0,I guess I wasn't meant to be a famous playwright. The novel version didn't go too well either.  
0,"I'm out here. Have to wake up early for Ate Jenny and my uniform and yeah, school. Goodbye summer.  Good night."
0,"@runningaway8 I am craving a hot milo.  Have no milk or milo... desperate   am drinking water, very boring!"
0,"@tigerinthedark Haha term breaks aren't holidays  That was the case for me. Gotta wait for the long one. Soon, soon! Jiayou!"
0,@ShoeGirl21 awwww I'm a get to see lari more! I miss her. 
0,on my way to check out a daycare/learning center to enroll jay in in august.  i hate this!
0,"@mileyfashion Same, I'll miss it too. "
0,"@birutagme there are notification options to disable them, have it at the bottom right corner etc... but I have not had any at all "
0,doing homework 
0,finished up the twilight series 
0,i have to go do the last part () of my history coursewrk ....so suckish! 
0,Working until 6. Got a hugeee order of dry goods in that need to be priced and put away.  I wanna go home!!
0,"@nachtaktiv same here  i yelled at the newspaper! bernadottes dont like us  anyway: beckmann, today!"
0,I'm hungryy..I woke up too late for breakfast 
0,@lorzy48 It's really odd to hear about storms. I want storms  It's really warm and sunny here
0,@SVGraphics I hate it here. 
0,"so apparently you can't get the flu after you have a flu shot..tell that to my aching joints, constant cough and fever "
0,"I know something is wrong when I can't watch One Tree Hill without wanting to cry...looking forward to next season, Magic...no Hedo?  "
0,@diddlysquit Haha its scaring me.... 
0,i hate mcdonalds!sick 
