0,"@kisluvkis oh that is very sad, poor boy. "
4,"@TeamFordRacing pass on the coffee, still enjoyed the podcast    Might wanna change out The Biff pic for Jamie though! ;)"
4,Cool! My Business Card page shows up on page one of google under &quot;Realtor Branding in Vancouver&quot; 
4,@RE_DANGEr You having fun? Mom's gonna take us to Rita's Italian Ice sometime! 
4,New Blog about a potential cake diaster!!  Ahhhh!    www.mandicrocker.blogspot.com
4,Its my first time on twitter so im jus looking around 
4,Cow photoshoot time. My moment of front page fame  Hahaha
4,"At the pool with miranda,john,steph,troy and Demarcus "
4,making some chicken cheese spinach manicotti 
4,"hehehe...I love my RP parents, @MamaRavenclaw and @Papa_Ravenclaw. "
4,@gingy23 it was amazing. I'm bruised ahaha! I felt so gross afterwards. see you Friday 
